{
 "slug": "sewer",
 "cond": {
  "T": "T2",
  "M": "M0"
 },
 "rep": 2,
 "stages": {
  "s1_ja": {
   "major": 0,
   "minor": 1
  },
  "s2_en": {
   "major": 0,
   "minor": 1
  }
 },
 "regressions": {
  "major": 0,
  "minor": 0
 },
 "direction_facts": [
  {
   "fact_id": "F-010",
   "label": "not_selected"
  },
  {
   "fact_id": "F-011",
   "label": "not_selected"
  },
  {
   "fact_id": "F-012",
   "label": "correct"
  }
 ],
 "ng_items": [
  {
   "id": "sewer-T2M0r2-01",
   "text": "R2(JA): 「福島県喜多方市は…」/ EN: \"Kitakata City in Fukushima Prefecture\"",
   "fact_id": "F-012",
   "severity": "minor",
   "stage": {
    "s1": true,
    "s2": true
   },
   "kind": "added_fact"
  }
 ],
 "pending": [
  {
   "id": "sewer-T2M0r2-P1",
   "text": "JA R2末尾: 「地下の管を減らす話であると同時に、町じゅうに小さな処理場を置く話でもある」",
   "reason": "本文で『一斉に撤去する話ではない』と述べており『管を減らす』は撤去のニュアンスと緊張。R0は『管の問題』でR2で新規。範囲の曖昧さ(軽微)か文章表現かの境界",
   "leaning": "minor(scope)"
  }
 ],
 "notes": "BOD20mg/L以下は環境省資料の説明として限定付きで記載(F-006 correct)。福島県はR0から継続。F-012 correct。単独評価・人間確認なし。"
}